ticker,date,news
ACN,2025-03-19T06:27:01Z,Accenture (NYSE:ACN) Upgraded by Robert W. Baird to “Outperform” Rating
ACN,2025-03-18T13:45:40Z,"Reddit initiated, Netflix upgraded: Wall Street’s top analyst calls"
ACN,2025-03-18T12:54:13Z,Accenture plc (ACN): Among the Best European Stocks to Buy According to Billionaires
ACN,2025-03-18T09:16:15Z,Piracy Shield: New Technical & Operational Requirements For 2025
ACN,2025-03-18T06:10:50Z,Morgan Stanley Cuts Accenture (NYSE:ACN) Price Target to $372.00
ACN,2025-03-17T16:19:00Z,Investigational Rinatabart Sesutecan (Rina-S®) Continues to Show Encouraging Antitumor Activity in Patients with Advanced Ovarian Cancer
ACN,2025-03-17T14:00:00Z,A new class of type VI secretion system effectors can carry two toxic domains and are recognized through the WHIX motif for export
ACN,2025-03-17T13:06:33Z,Accenture (ACN) Strengthens AI Infrastructure Consulting with Soben Acquisition
ACN,2025-03-17T06:22:52Z,Piper Sandler Has Lowered Expectations for Accenture (NYSE:ACN) Stock Price
ACN,2025-03-16T21:16:43Z,These are the 10 most shorted ASX shares
ACN,2025-03-16T12:00:19Z,"Earnings week ahead: FDX, GIS, NIO, XPEV, MU, NKE, CCL, ACN and more"
ACN,2025-03-16T10:59:08Z,Wall Street Week Ahead
ACN,2025-03-16T09:00:00Z,"Nvidia, Nike, Micron, Darden Restaurants: Stocks to watch this week"
ACN,2025-03-16T06:02:59Z,Artificial Intelligence Stocks Worth Watching – March 14th
ACN,2025-03-16T06:02:48Z,Industrial Stocks To Follow Now – March 14th
ACN,2025-03-16T00:05:58Z,"Presidency, SDP leader deny Tinubu’s funding claim"
ACN,2025-03-15T10:23:00Z,Church leaders call for 'rethink' of school closures in Ramadan
ACN,2025-03-15T06:34:52Z,Best Industrial Stocks To Follow Today – March 13th
ACN,2025-03-15T00:39:19Z,Buhari’s ex-ministers lead APC defection train to SDP
ACN,2025-03-14T19:10:00Z,‘No future for Syria without Christians’: Archbishop calls for justice for massacre victims
ACN,2025-03-14T06:02:56Z,Top Metaverse Stocks To Watch Now – March 12th
ACN,2025-03-13T06:22:55Z,Accenture (ACN) Projected to Post Earnings on Thursday
ACN,2025-03-13T06:02:50Z,Promising Metaverse Stocks To Keep An Eye On – March 11th
ACN,2025-03-12T18:19:00Z,Transactions with shares and linked securities in Genmab A/S made by managerial employees and their closely associated persons
ACN,2025-03-12T18:13:00Z,"Constitution of the Board of Directors in Genmab A/S, Grant of Restricted Stock Units to Board Members and Employees and Grant of Warrants to Employees in Genmab"
ACN,2025-03-12T14:23:00Z,Passing of Genmab A/S’ Annual General Meeting
ACN,2025-03-12T07:36:51Z,Accenture (NYSE:ACN) Downgraded by StockNews.com to “Hold”
ACN,2025-03-12T06:02:50Z,Best Metaverse Stocks To Follow Today – March 10th
ACN,2025-03-11T08:14:48Z,Promising Metaverse Stocks To Add to Your Watchlist – March 9th
ACN,2025-03-11T01:41:46Z,17% off Any Travel Insurance Policies from InsureandGo + Bonus 10% Couple and Family Discount @ One Big Switch
ACN,2025-03-10T14:13:00Z,Genmab Announces Johnson & Johnson Decision Regarding HexaBody®-CD38
ACN,2025-03-10T06:02:47Z,Best Metaverse Stocks To Follow Today – March 8th
ACN,2025-03-09T19:48:53Z,These are the 10 most shorted ASX shares
ACN,2025-03-09T09:22:53Z,"SBI Securities Co. Ltd. Makes New $99,000 Investment in Accenture plc (NYSE:ACN)"
ACN,2025-03-09T07:10:55Z,Sen. Shelley Moore Capito Sells Accenture plc (NYSE:ACN) Shares
ACN,2025-03-09T07:04:58Z,Top Metaverse Stocks To Follow Today – March 7th
ACN,2025-03-08T18:27:43Z,"Embrace Ngige, APC aspirant begs Tinubu"
INFY,2025-04-03T07:04:55Z,"58,677 Shares in Infosys Limited (NYSE:INFY) Acquired by Raymond James Financial Inc."
INFY,2025-04-02T08:29:00Z,Infosys and Formula E Launch AI-Powered Stats Center to Boost Fan Engagement
INFY,2025-04-02T01:05:50Z,Stock Market Live Updates 2 April 2025: Stock to buy today: HDFC Life Insurance Company (₹693.10)
INFY,2025-04-02T01:05:50Z,"Stock Market Highlights 2 April 2025: Sensex, Nifty close higher as markets reassess impact of anticipated reciprocal tariffs"
INFY,2025-03-31T15:13:03Z,Is Infosys Limited (INFY) the Most Oversold Large Cap Stock to Invest in Now?
INFY,2025-03-31T08:24:48Z,Infosys Limited (NYSE:INFY) Shares Sold by Prudential Financial Inc.
INFY,2025-03-30T09:42:53Z,"Stock Market Highlights 1 April 2025: BSE Sensex closes at 1390 points lower at 76,024.51, and Nifty 50 plunges by 353 points to 23,165.70"
INFY,2025-03-27T13:28:13Z,"Infy lays off trainees; Amazon, Flipkart warehouses raided"
INFY,2025-03-27T10:23:00Z,Infosys Powers LKQ Europe's HR Transformation with a Unified Digital Platform
INFY,2025-03-27T07:52:58Z,"Thrivent Financial for Lutherans Sells 3,390 Shares of Infosys Limited (NYSE:INFY)"
INFY,2025-03-24T08:21:08Z,"Corient Private Wealth LLC Sells 6,842 Shares of Infosys Limited (NYSE:INFY)"
INFY,2025-03-24T06:54:11Z,"Ditch the Accenture Prism. TCS, Infy good bets as FIIs resume shopping"
INFY,2025-03-24T01:10:00Z,"Share Market Highlights: Sensex jumps 1.4%, Nifty gains 1.32% as foreign buying lifts markets"
INFY,2025-03-22T08:42:53Z,HighTower Advisors LLC Has $2.61 Million Position in Infosys Limited (NYSE:INFY)
INFY,2025-03-22T07:00:51Z,Infosys (NYSE:INFY) Rating Lowered to Hold at StockNews.com
INFY,2025-03-21T09:18:55Z,Avantax Advisory Services Inc. Cuts Stake in Infosys Limited (NYSE:INFY)
INFY,2025-03-19T05:48:59Z,"Zomato, Paytm, PB Fintech: Is it time to re-enter these high-beta stocks? Dipan Mehta answers"
INFY,2025-03-14T05:52:53Z,Analysts Set Infosys Limited (NYSE:INFY) PT at $20.22
INFY,2025-03-12T05:50:51Z,Infosys (NYSE:INFY) Rating Lowered to Hold at StockNews.com
INFY,2025-03-12T05:13:04Z,Infosys Target of Unusually High Options Trading (NYSE:INFY)
INFY,2025-03-11T10:43:21Z,alice-blue-sdk added to PyPI
INFY,2025-03-11T07:14:56Z,Bank of New York Mellon Corp Decreases Stake in Infosys Limited (NYSE:INFY)
INFY,2025-03-10T17:06:00Z,Cholamandalam Investment and Finance Company migrates to Finacle Treasury
INFY,2025-03-08T04:26:46Z,"Nifty will recover gradually, may climb towards 23,600: Rupak De"
SAP,2025-04-05T12:30:00Z,"2025 March Madness Final Four predictions: Duke vs. Houston, Florida vs. Auburn"
SAP,2025-04-05T12:12:08Z,Show HN: Rudolf – The SAP Guru
SAP,2025-04-05T12:00:00Z,Northern giant mouse lemur: The bug-eyed fluff ball with the biggest testicles of all known primates
SAP,2025-04-05T10:02:37Z,"Port of Seattle ‘s August data breach impacted 90,000 people"
SAP,2025-04-05T08:39:10Z,"JPMorgan Chase & Co. Sells 519,800 Shares of Vertex, Inc. (NASDAQ:VERX)"
SAP,2025-04-05T05:54:54Z,Saputo Inc. (TSE:SAP) Receives Consensus Rating of “Buy” from Analysts
SAP,2025-04-05T01:30:00Z,"Kathy Donaghy: As spring arrives, the birds and the bees can offer us lessons in love"
SAP,2025-04-04T16:24:30Z,Polymers with flawed fillers boost heat transfer in plastics
SAP,2025-04-04T16:00:00Z,Whangārei dad battles invasive moth plant threatening native trees
SAP,2025-04-04T15:30:00Z,How Doris Connects to Multiple Databases for Federated Analytics and Data Migration
SAP,2025-04-04T15:25:01Z,Global brokerages raise recession odds; J.P.Morgan sees 60% chance (Siddarth S/Reuters)
SAP,2025-04-04T14:00:00Z,"The Rise of US Customer Data Platform Market: A $6.4 billion Industry Dominated by Oracle Corporation, Adobe & Salesforce | MarketsandMarkets™"
SAP,2025-04-04T14:00:00Z,Combining nanobody labeling with STED microscopy reveals input-specific and layer-specific organization of neocortical synapses
SAP,2025-04-04T13:55:00Z,Cloud Point of Sale (PoS) Market Report 2025-2029 & 2034 | From $8.37 Billion to $20.67 Billion: The Exponential Rise of the Cloud PoS Market
SAP,2025-04-04T13:48:17Z,President Trump fired the head of U.S. Cyber Command and NSA
SAP,2025-04-04T13:00:00Z,2X Awarded on the Financial Times Americas’ Fastest Growing Companies 2025 List
SAP,2025-04-04T12:05:28Z,DT builds its ‘AI-first’ strategy on Google Cloud
SAP,2025-04-04T11:27:39Z,"Urgent recall hits 17,000 bottles of iron supplements"
SAP,2025-04-04T11:00:00Z,"The Offertory Incensation, Part I"
SAP,2025-04-04T10:55:14Z,"PR Roundup: Ford’s Ad Campaign Offering ‘Employee Pricing’, Brands’ DEI and Sustainability Comms Ranked Globally"
SAP,2025-04-04T10:49:58Z,Restoring the Wild: How Reintroducing Bison Could Revive Britain’s Landscapes and Ecosystems
SAP,2025-04-04T10:00:26Z,Critical flaw in Apache Parquet’s Java Library allows remote code execution
SAP,2025-04-04T08:32:24Z,CERT-UA reports attacks in March 2025 targeting Ukrainian agencies with WRECKSTEEL Malware
SAP,2025-04-04T08:05:08Z,"Vertex, Inc. (NASDAQ:VERX) Shares Sold by Corebridge Financial Inc."
SAP,2025-04-04T06:48:25Z,39M secrets exposed: GitHub rolls out new security tools
SAP,2025-04-04T06:08:55Z,Desjardins Comments on Saputo’s FY2025 Earnings (TSE:SAP)
SAP,2025-04-04T05:10:47Z,The Hackett Group (NASDAQ:HCKT) Stock Rating Upgraded by StockNews.com
SAP,2025-04-04T04:00:00Z,Uncertainty Of The EU Omnibus And How Businesses Should Respond
SAP,2025-04-04T00:00:00Z,What is employee experience?
SAP,2025-04-03T19:39:17Z,Oil Prices Dive on Trump Tariffs and OPEC Surprise
SAP,2025-04-03T19:37:57Z,China-linked group UNC5221 exploited Ivanti Connect Secure zero-day since mid-March
SAP,2025-04-03T19:36:21Z,New battery tech makes sub-zero EV charging 5x faster
SAP,2025-04-03T18:59:56Z,How To Accelerate Digital Transformation
SAP,2025-04-03T18:58:53Z,These Organized Trips Blend Reforesting Efforts With Experiential Travel
SAP,2025-04-03T18:44:37Z,Bat Speed Risers and Fallers: Breakouts coming for Pete-Crow Armstrong and Ryan Mountcastle?
SAP,2025-04-03T18:30:00Z,"Sweeping Trump tariffs draw dismay, calls for talks from countries around the globe"
SAP,2025-04-03T18:30:00Z,"Sweeping Trump tariffs draw dismay, calls for talks from countries around the globe"
SAP,2025-04-03T18:14:15Z,Master the World of Information Technology
SAP,2025-04-03T15:20:19Z,AI Workforce: using AI and Drones to simplify infrastructure inspections
SAP,2025-04-03T14:51:00Z,OpenText Announces Availability of Titanium X Enabling new Limitless Digital Workforce
SAP,2025-04-03T14:22:23Z,"Europol-led operation shuts down CSAM platform Kidflix, leading to 79 arrests"
SAP,2025-04-03T13:41:40Z,Show HN: Docsumo's OCR Benchmark Report – Surpassing Mistral and Landing AI
SAP,2025-04-03T13:33:36Z,In Light Of New Tariffs Focus On Digitizing And Diversifying Your Supply Chain
SAP,2025-04-03T13:30:38Z,10 native spring ephemerals that bring early color to the garden
SAP,2025-04-03T11:39:00Z,Smart Hospitals Industry Analysis Report 2025 | $187.2 Billion Opportunity by 2030 | Investing in AI and Robotics Among the Key Strategies of Market Leaders
SAP,2025-04-03T10:50:30Z,3 Ways To Comply With Plastic Taxes
SAP,2025-04-03T10:49:58Z,robotframework-robosapiens 2.16.4
SAP,2025-04-03T10:02:37Z,Author Spotlight: Sarah Langan
SAP,2025-04-03T07:44:53Z,"Mitsubishi UFJ Asset Management Co. Ltd. Buys 1,718 Shares of SAP SE (NYSE:SAP)"
SAP,2025-04-03T07:37:02Z,"Vertex, Inc. (NASDAQ:VERX) Shares Purchased by Vanguard Group Inc."
SAP,2025-04-03T06:10:44Z,Financial Analysis: TuanChe (NASDAQ:TC) versus Rimini Street (NASDAQ:RMNI)
SAP,2025-04-03T05:16:20Z,New Triada Trojan comes preinstalled on Android devices
SAP,2025-04-03T04:31:28Z,Hero Motocorp shares in focus after posting 12% YoY growth in monthly sales
SAP,2025-04-03T04:10:59Z,"Persistent, Wipro, other IT stocks fall up to 8% as Trump tariffs fuel inflation fears"
SAP,2025-04-03T03:44:56Z,RIL shares in focus for these 2 reasons. Check details
SAP,2025-04-03T02:33:01Z,pydanticai-genai-hub 0.1.10
SAP,2025-04-03T02:26:26Z,pydanticai-genai-hub 0.1.9
SAP,2025-04-03T02:13:17Z,Trump tariffs pile stress on ailing world economy
SAP,2025-04-03T02:02:51Z,"Stocks Drop, Bonds Jump as Trump Tariffs Sap Risk: Markets Wrap"
SAP,2025-04-03T01:35:03Z,Trump tariffs pile stress on ailing world economy
SAP,2025-04-03T01:29:00Z,Trump tariffs pile stress on ailing world economy
SAP,2025-04-03T01:04:49Z,"Asian stocks drop, bonds jump as Trump tariffs sap risk"
SAP,2025-04-02T22:18:43Z,Analysis-Trump tariffs pile stress on ailing world economy
SAP,2025-04-02T21:38:24Z,New advanced FIN7’s Anubis backdoor allows to gain full system control on Windows
SAP,2025-04-02T19:37:09Z,Is SAP SE (SAP) the Best German Stock to Buy According to Hedge Funds?
SAP,2025-04-02T18:30:14Z,"Bitcoin Braces For Trump Tariff Announcement: 'Short-Term Optimism' Has The Upper Hand, Experts Say"
SAP,2025-04-02T15:52:02Z,Delta flier says she was shamed by passenger squatting in her own window seat
SAP,2025-04-02T15:50:00Z,Databricks on Google Cloud: Innovations Driving Data Intelligence
SAP,2025-04-02T15:00:00Z,Supplier Relationship and Risk Management (SRRM) Market Disruptions: The $1.45 Billion Opportunity Vendors Can’t Afford to Miss
SAP,2025-04-02T15:00:00Z,Warehouse Management System Market Disruptions: The $5.2 Billion Opportunity Vendors Can’t Afford to Miss
SAP,2025-04-02T14:34:04Z,Spring 2025 – Week 1 in Review
SAP,2025-04-02T14:00:00Z,Explore these 7 popular API gateway tools
SAP,2025-04-02T13:47:39Z,U.S. CISA adds Apache Tomcat flaw to its Known Exploited Vulnerabilities catalog
SAP,2025-04-02T13:03:53Z,"Anywhere365 drives the transformation of customer experience with AI, and unveils new identity: AnywhereNow"
SAP,2025-04-02T12:41:05Z,What Does Business Transformation Mean?
SAP,2025-04-02T12:34:02Z,"How Tally Solutions, bookkeeper to India’s MSMEs, is harnessing AI in its software"
SAP,2025-04-02T12:30:00Z,India BPO Services Market to Hit Valuation of US$ 139.35 Billion by 2033 | Astute Analytica
SAP,2025-04-02T12:00:00Z,Concur Founder Backs New Corporate Travel Startup Juno
SAP,2025-04-02T09:27:51Z,Tildearrow Furnace (Chiptune Tracker) v0.6.8 WiN Mac Linux [FREE]
SAP,2025-04-02T09:02:00Z,Nagarro strengthens its SAP CX capabilities with the strategic business transfer of Notion Edge France
SAP,2025-04-02T08:52:53Z,Apple backported fixes for three actively exploited flaws to older devices
SAP,2025-04-02T08:38:15Z,"Specsavers takes off the Oracle glasses, sees better ERP options"
SAP,2025-04-02T08:34:00Z,API Management Industry Analysis 2025-2030: Increasing Demand for Web and Mobile Applications Across Diverse Platforms Drive the Global Market; Rising at 14.57% CAGR
SAP,2025-04-02T08:31:00Z,AI-Based Predictive Maintenance Market Report 2025-2030: A Projected US$1.69 Billion Landscape - Businesses Must Invest in Cloud and Edge Technologies for Future Success
SAP,2025-04-02T08:21:00Z,Edge Data Centers Industry Analysis 2018-2024 & 2025-2030 - Decentralized Infrastructure Gains Momentum as Edge Data Centers Drive Real-Time Processing
SAP,2025-04-02T08:12:56Z,"KLP Kapitalforvaltning AS Makes New $667,000 Investment in Vertex, Inc. (NASDAQ:VERX)"
SAP,2025-04-02T08:08:00Z,Cloud Services Industry Analysis 2025-2030: Global Revenues Set to Triple Reaching US$2.9 Trillion by 2030 - Asia-Pacific's Rapid Industrialization and Digitalization Drive Explosive Growth
SAP,2025-04-02T08:00:15Z,"Flight passenger says man deliberately squatted in window seat, ignites social media debate"
SAP,2025-04-02T07:42:48Z,"Thrivent Financial for Lutherans Has $846,000 Holdings in SAP SE (NYSE:SAP)"
SAP,2025-04-02T07:29:05Z,Spike in Palo Alto Networks scanner activity suggests imminent cyber threats
SAP,2025-04-02T07:22:58Z,Labor wants to give the minimum wage a real boost. The benefits would likely outweigh any downsides
SAP,2025-04-02T07:00:00Z,"Anywhere365 drives the transformation of customer experience with AI, and unveils new identity: AnywhereNow"
SAP,2025-04-02T07:00:00Z,"Anywhere365 drives the transformation of customer experience with AI, and unveils new identity: AnywhereNow"
SAP,2025-04-02T06:02:49Z,Top Metaverse Stocks To Research – March 31st
SAP,2025-04-02T05:01:29Z,How one of the largest auto suppliers in the world is preparing for Trump's tariffs
SAP,2025-04-01T23:01:01Z,Homes England and Octopus Real Estate launch £150m Greener Homes Alliance phase 2
SAP,2025-04-01T21:53:43Z,How District Courts Are Approaching Alice’s Failure to Define ‘Abstract Ideas’
SAP,2025-04-01T19:53:22Z,The Problem Isn’t Tinder’s New AI but the Dating Apps Themselves
