ticker,date,news
MSFT,2025-04-03T15:15:38Z,Inquiry Into Microsoft's Competitor Dynamics In Software Industry
MSFT,2025-04-03T15:03:00Z,Veteran fund manager who forecast S&P 500 crash unveils surprising update
MSFT,2025-04-03T14:35:00Z,Apple leads Magnificent 7 stock drop amid Trump tariffs
MSFT,2025-04-03T13:30:46Z,"Stock market today: S&P 500, Nasdaq plunge, Dow drops 1,400 points as Trump's tariffs shock markets"
MSFT,2025-04-03T12:40:54Z,Here’re the Reasons Why Artisan Global Opportunities Fund Ended Its Investment Campaigns in Microsoft Corporation (MSFT)
MSFT,2025-04-03T12:30:00Z,"Stocks tumble after Trump's tariff reveal, with Dow set to shed 1,000 points"
MSFT,2025-04-03T12:22:22Z,Here’re the Reasons Why Artisan Global Opportunities Fund Ended Its Investment Campaigns in Microsoft Corporation (MSFT)
MSFT,2025-04-03T12:12:42Z,Big Tech 'Magnificent Seven' Stocks Take a Hammering in Premarket
MSFT,2025-04-03T12:12:13Z,softrader added to PyPI
MSFT,2025-04-03T12:03:33Z,"Questrade introduces $0 commission, real-time fractional stock and ETF trading, reminding Canadians there’s no better time to Get Yours"
MSFT,2025-04-03T12:00:00Z,"Questrade introduces $0 commission, real-time fractional stock and ETF trading, reminding Canadians there’s no better time to Get Yours"
MSFT,2025-04-03T11:58:00Z,"Mag 7, Nike, Lululemon, Deckers, PDD, GM: Stocks to watch"
MSFT,2025-04-03T10:18:33Z,Global Stocks Plunge on Larger-Than-Expected US Tariffs
MSFT,2025-04-03T09:00:00Z,Microsoft will announce AI next steps at anniversary tomorrow. Here's what to expect
MSFT,2025-04-03T09:00:00Z,11 of the world’s most expensive and unique art collections
MSFT,2025-04-03T08:22:53Z,Clayton Financial Group LLC Sells 62 Shares of Microsoft Co. (NASDAQ:MSFT)
MSFT,2025-04-03T08:22:52Z,Private Management Group Inc. Buys 121 Shares of Microsoft Co. (NASDAQ:MSFT)
MSFT,2025-04-03T08:22:50Z,Microsoft Co. (NASDAQ:MSFT) Shares Purchased by Robertson Stephens Wealth Management LLC
MSFT,2025-04-03T08:22:49Z,Onyx Bridge Wealth Group LLC Boosts Stock Holdings in Microsoft Co. (NASDAQ:MSFT)
MSFT,2025-04-03T08:22:49Z,Microsoft Co. (NASDAQ:MSFT) Stock Holdings Lessened by Long Run Wealth Advisors LLC
MSFT,2025-04-03T07:34:49Z,Westpark Capital Initiates Coverage on Microsoft (NASDAQ:MSFT)
MSFT,2025-04-03T07:03:04Z,Vision Capital Management Inc. Reduces Holdings in Microsoft Co. (NASDAQ:MSFT)
MSFT,2025-04-03T07:02:56Z,Summit Wealth Partners LLC Has $2.86 Million Stock Holdings in Microsoft Co. (NASDAQ:MSFT)
MSFT,2025-04-03T07:02:55Z,"Bleakley Financial Group LLC Acquires 2,903 Shares of Microsoft Co. (NASDAQ:MSFT)"
MSFT,2025-04-03T07:02:54Z,Vanderbilt University Has $7.15 Million Holdings in Microsoft Co. (NASDAQ:MSFT)
MSFT,2025-04-03T07:02:49Z,Capital Investment Services of America Inc. Raises Holdings in Microsoft Co. (NASDAQ:MSFT)
MSFT,2025-04-03T07:02:48Z,NovaPoint Capital LLC Buys 412 Shares of Microsoft Co. (NASDAQ:MSFT)
MSFT,2025-04-03T06:40:43Z,Technology Stocks To Watch Now – April 1st
MSFT,2025-04-03T04:16:50Z,How are the 'Magnificent Seven' reacting to Trump's tarrifs in aftermarket trade?
MSFT,2025-04-02T23:41:00Z,Trump’s tariffs are having a surprising impact on the U.S. dollar. Here’s how investors can benefit.
MSFT,2025-04-02T22:05:00Z,"Mag 7, other stocks fall post-market after Trump's tariff announcement"
MSFT,2025-04-02T21:10:00Z,"I can own Apple, Nvidia, Microsoft, and Tesla with this simple ASX ETF"
MSFT,2025-04-02T15:15:39Z,Understanding Microsoft's Position In Software Industry Compared To Competitors
MSFT,2025-04-02T13:21:10Z,Molson Coors Nominates Chris Cocks as an Independent Director to Join Its Board of Directors
MSFT,2025-04-02T12:33:00Z,A coal plant in Pennsylvania was imploded to build an AI data center
MSFT,2025-04-02T11:56:00Z,"Tesla, Newsmax, Big Tech: Stocks to watch today"
MSFT,2025-04-02T09:00:00Z,Microsoft is turning 50. Here are 4 of its peers that are also still around
MSFT,2025-04-02T08:43:00Z,Virginia Wealth Management Group Inc. Has $5.51 Million Stock Position in Microsoft Co. (NASDAQ:MSFT)
MSFT,2025-04-02T08:43:00Z,Microsoft Co. (NASDAQ:MSFT) is Meritage Portfolio Management’s 2nd Largest Position
MSFT,2025-04-02T08:42:59Z,Osprey Private Wealth LLC Raises Stock Holdings in Microsoft Co. (NASDAQ:MSFT)
MSFT,2025-04-02T08:42:58Z,Microsoft Co. (NASDAQ:MSFT) Shares Sold by Martin Capital Partners LLC
MSFT,2025-04-02T08:42:57Z,Microsoft Co. (NASDAQ:MSFT) is Lockheed Martin Investment Management Co.’s 2nd Largest Position
MSFT,2025-04-02T08:42:57Z,Tectonic Advisors LLC Has $5.35 Million Holdings in Microsoft Co. (NASDAQ:MSFT)
MSFT,2025-04-02T08:42:56Z,Massachusetts Wealth Management Sells 77 Shares of Microsoft Co. (NASDAQ:MSFT)
MSFT,2025-04-02T07:08:59Z,Microsoft Co. (NASDAQ:MSFT) is Alexander Labrunerie & CO. Inc.’s 6th Largest Position
MSFT,2025-04-02T07:08:58Z,"Stratos Wealth Advisors LLC Sells 3,027 Shares of Microsoft Co. (NASDAQ:MSFT)"
MSFT,2025-04-02T07:08:50Z,Retirement Systems of Alabama Has $1.13 Billion Position in Microsoft Co. (NASDAQ:MSFT)
MSFT,2025-04-02T07:08:50Z,Aua Capital Management LLC Sells 753 Shares of Microsoft Co. (NASDAQ:MSFT)
MSFT,2025-04-02T06:36:51Z,Microsoft (NASDAQ:MSFT) Trading Down 2.8% After Analyst Downgrade
MSFT,2025-04-02T05:54:56Z,Microsoft (NASDAQ:MSFT) Price Target Lowered to $500.00 at Jefferies Financial Group
MSFT,2025-04-02T05:12:49Z,Microsoft (NASDAQ:MSFT) Sets New 1-Year Low on Analyst Downgrade
MSFT,2025-04-01T22:09:35Z,Microsoft Corporation (MSFT): Among The Best US Stocks To Buy For Foreign Investors
MSFT,2025-04-01T20:03:00Z,S&P 500 and Nasdaq post worst quarter since 2022. Time to buy NDQ on sale?
MSFT,2025-04-01T17:25:48Z,"Jim Cramer’s Was Absolutely Wrong As Nvidia (NVDA), Microsoft (MSFT) and Tesla (TSLA) Shoot Higher Today"
AMD,2025-04-05T14:13:16Z,"AMD Plans To Release An “AI-Focused” Ryzen Z2 AI Extreme SoC For Gaming Handhelds, Competing With Intel’s Lunar Lake"
AMD,2025-04-05T13:31:10Z,Award-winning 32-inch 4K 240 Hz QD-OLED gaming monitor is now available at a record-low price of $759
AMD,2025-04-05T12:40:31Z,LG UltraGear Curved Gaming Monitor Sees Its First Major Price Drop of the Year on Amazon
AMD,2025-04-05T12:00:00Z,"I reviewed the Samsung QN900F: good enough to sway 8K cynics, and it’s not even Samsung’s most expensive 8K TV"
AMD,2025-04-05T11:30:58Z,Sapphire Nitro+ Radeon RX 7900 XTX 24GB GPU $1699 + Delivery ($0 to Metro Areas/ SYD C&C) @ Mwave
AMD,2025-04-05T11:05:57Z,(Help) How To Play Games On Steam With GPU Accelerated Rendering On In Ubuntu (With KDE Kubuntu Desktop Environment) AMD Gpu
AMD,2025-04-05T11:05:57Z,How To Play Games On Steam With GPU Accelerated Rendering On Ubuntu (With KDE Kubuntu Desktop Environment) AMD Gpu
AMD,2025-04-05T11:00:00Z,AMD Ryzen CPU failures: what’s happened and what it means for you
AMD,2025-04-05T10:35:00Z,LACT 0.7.3 Further Enhances This GPU Configuration & Monitoring Tool
AMD,2025-04-05T10:12:03Z,Ubuntu 22.04 installation error
AMD,2025-04-05T10:07:55Z,"GMKtec Mini PC M7: Ryzen 7 PRO 6850H, 16DDR5, 512GB SSD $346.99"
AMD,2025-04-05T10:02:37Z,"Port of Seattle ‘s August data breach impacted 90,000 people"
AMD,2025-04-05T09:29:03Z,"Indiana Jones, South of Midnight and More: The Biggest Games of April"
AMD,2025-04-05T09:13:39Z,Russell Coker: More About the HP ML110 Gen9 and z640
AMD,2025-04-05T08:00:00Z,Daily Tech News 5 April 2025
AMD,2025-04-05T07:09:02Z,"Deals: Moto Edge 60 Fusion and Pixel 9a arrive, iPhone 16  and 15 series are £100 off"
AMD,2025-04-05T06:10:53Z,"Steam games open on wrong monitor, mismatched input and resolution"
AMD,2025-04-05T06:07:01Z,Brokers Set Expectations for Kodiak Sciences Q2 Earnings
AMD,2025-04-05T05:24:01Z,PARLIAMENT QUESTION: NEW URANIUM DEPOSITS
AMD,2025-04-05T05:23:35Z,PARLIAMENT QUESTION: OPERATIONAL NUCLEAR POWER PLANTS
AMD,2025-04-05T01:57:14Z,Is whakapapa the answer to better health treatment?
AMD,2025-04-05T01:54:25Z,PARLIAMENT QUESTION: NATIONAL RARE EARTHS POLICY
AMD,2025-04-05T01:22:27Z,"changing owner of all Ubuntu files, possible hack?"
AMD,2025-04-05T01:12:50Z,AMD Ryzen 7 5800XT 8-Core/16-Thread Unlocked Desktop Processor $140 + Free Shipping
AMD,2025-04-05T00:30:00Z,11 months & counting: Open Cloud Compute yet to go live
AMD,2025-04-04T23:06:28Z,G.Skill unveils lightning-fast DDR5 128GB RAM and 64GB RAM kits
AMD,2025-04-04T21:50:16Z,Windows Hotpatch comes to client version of Windows
AMD,2025-04-04T21:24:05Z,"27"" Samsung C27F390 Curved 1800R Monitor: FHD, AMD FreeSync, HDMI, VGA, VESA Mount $85 + Free Shipping w/ Prime"
AMD,2025-04-04T21:04:29Z,Buy or Wait Guide: 10 Experts Predict How Tariffs Will Change Tech Prices in 2025 and What to Do Now
AMD,2025-04-04T20:51:00Z,"This mini PC has a 7-inch display that can apparently run Windows and an AMD Ryzen 9 CPU, but there's even better options to be had"
AMD,2025-04-04T20:43:26Z,Microsoft Launches Copilot Vision for iOS and Android
AMD,2025-04-04T20:26:39Z,PC Vendors Scramble to Figure Out How Much Tariffs Will Cost Them (and You)
AMD,2025-04-04T20:26:39Z,PC Vendors Scramble to Figure Out How Much Tariffs Will Cost Them (and You)
AMD,2025-04-04T20:08:00Z,"Hotpatch Updates Come To Windows, Reducing Downtime"
AMD,2025-04-04T20:00:00Z,Broker laments 'catastrophic negative surprise' that highlights the risks with these types of ASX shares
AMD,2025-04-04T19:37:00Z,"Chinese brand’s $2,000 Ryzen AI Max+ mini PC set to go on sale, with the first unit personally signed by the CEO of AMD"
AMD,2025-04-04T19:00:39Z,"Inworld AI GDC 2025 Q&A – ‘AAA Games Want to Be Secret, But There’s Going to Be Announcements in the Summer’"
AMD,2025-04-04T19:00:39Z,"Inworld AI GDC 2025 Q&A – ‘AAA Games Want to Be Secret, But There’s Going to Be Large Titles Announced’"
AMD,2025-04-04T18:50:17Z,This 4K gaming monitor is on sale for its lowest price ever
AMD,2025-04-04T18:47:02Z,Nintendo Switch 2 Tech Analysis: Is 4K Actually Realistic?
AMD,2025-04-04T18:39:45Z,Switch 2 vs. PS5: which console is worth owning in 2025
AMD,2025-04-04T18:38:00Z,LG Launches Three New Premium Curved Gaming Monitors With 240Hz Refresh Rates
AMD,2025-04-04T18:12:04Z,Trump raises eyebrows by sharing video claiming he's 'purposely CRASHING the market'
AMD,2025-04-04T17:55:53Z,(PR) MangoBoost Achieves Record-Breaking MLPerf Inference v5.0 Results with AMD Instinct MI300X
AMD,2025-04-04T17:54:56Z,Grand Theft Auto 5 crashes into Xbox Game Pass on April 15
AMD,2025-04-04T17:43:00Z,"Chips mostly dodged Trump's tariffs, but that could soon change"
AMD,2025-04-04T17:32:46Z,"While Sellers Are Panicking Today, Wall Street Experts See 32% to 79% Gains This Year For AMD, Broadcom and CrowdStrike"
AMD,2025-04-04T17:11:29Z,Intel Vision 2025: CEO Lip-Bu Tan Charts A New Course For Execution
AMD,2025-04-04T17:08:51Z,"Lil Yachty x Veeze Reconnect on ""Can't Be Crete Boy"""
AMD,2025-04-04T17:00:40Z,Thunder Compute (YC S24) is hiring a GPU systems engineer
AMD,2025-04-04T16:25:27Z,Asus vivobook artifacts
AMD,2025-04-04T16:23:37Z,Nintendo has delayed Switch 2 pre-orders in the US 'to assess the potential impact of tariffs' and it feels like a straight warning of the hardware price rises to come
AMD,2025-04-04T16:17:33Z,All of the news from Microsoft’s 50th Anniversary Copilot event
AMD,2025-04-04T16:03:59Z,For once PC gamers in the UK are getting some of the best graphics cards deals with many at or near MSRP pricing AND there's availability of most GPU models
AMD,2025-04-04T16:00:48Z,Crisp new 4K external display brightens MacBook Pro rig’s visuals [Setups]
AMD,2025-04-04T15:57:46Z,"Trump tanks tech, AI resets cybersecurity, and OpenAI sets a fundraising record"
AMD,2025-04-04T15:57:46Z,"Trump tanks tech, Intel and TSMC do a deal, and OpenAI sets a fundraising record"
AMD,2025-04-04T15:47:42Z,Inside Info Suggests AMD Prepping Radeon RX 9070 GRE 12 GB Model as Chinese Market Exclusive
AMD,2025-04-04T15:38:54Z,"GMKtec M7 Pro: πανίσχυρο «εργαλείο» με Ryzen 7 PRO, 16GB/512GB στα 366€!"
AMD,2025-04-04T15:20:02Z,Nvidia just fixed an AMD Linux bug while it struggles itself with Windows driver issues
AMD,2025-04-04T15:14:00Z,A Cheaper AMD Radeon RX 9070 Is Rumored With These Spec Changes
AMD,2025-04-04T15:12:37Z,"The RTX 5060 Ti is rumoured to cost the same as the RTX 4060 Ti, which may leave it wide open for an AMD RX 9070-based assault"
AMD,2025-04-04T15:08:23Z,Build a Killer $230 Gaming PC with SteamOS : Affordable Power for Modern Games
AMD,2025-04-04T14:48:00Z,Intel and TSMC reach preliminary agreement on US chip manufacturing joint venture
AMD,2025-04-04T14:38:52Z,Intel Vision 2025 Event: An Iconic American Semiconductor Tech Titan
AMD,2025-04-04T14:35:00Z,G.Skill Unveils First Big 128GB DDR5 Memory Kit To Hit A Blistering 8000MHz
AMD,2025-04-04T14:20:28Z,AMD RDNA 3.5 Graphics On 2025 Drivers: Windows 11 vs. Ubuntu 25.04 iGPU Performance
AMD,2025-04-04T14:16:17Z,"Another new Steam Deck rival is coming, packing a seriously powerful processor"
AMD,2025-04-04T14:00:51Z,Samsung CF390 Series 27″ Curved 1800R Desktop Monitor $84.99 (Reg. $189) at WOOT!
AMD,2025-04-04T14:00:00Z,"Leverage Shares by Themes Launches Three New Single Stock Leveraged ETFs, Bringing Investors Exciting Opportunities to Amplify Exposure to Square (XYZ), Salesforce (CRM), and PayPal (PYPL)"
AMD,2025-04-04T14:00:00Z,"AI Update, April 4, 2025: AI News and Views From the Past Week"
AMD,2025-04-04T14:00:00Z,"13 Habits Secretly Hurting Your Eyes, According to Optometrists"
AMD,2025-04-04T13:53:28Z,The Intel-TSMC unholy chip factory alliance rumour re-emerges and this time a 'preliminary' deal is said to have been done
AMD,2025-04-04T13:52:34Z,Why I’ve covered Microsoft for 25 years
AMD,2025-04-04T13:48:17Z,President Trump fired the head of U.S. Cyber Command and NSA
AMD,2025-04-04T13:36:42Z,RTX 4060 is now the top GPU on Newegg despite ludicrous $500 price tag
AMD,2025-04-04T13:00:25Z,"Welcome back, Razer: After a PC Gamer gaming laptop showdown, I reckon the Blade 16 is the mobile machine to beat this generation"
AMD,2025-04-04T13:00:19Z,AMD RX 9070 XT vs Nvidia RTX 4080 Super
AMD,2025-04-04T13:00:00Z,The Nintendo Switch 2 almost makes PC gaming look cheap
AMD,2025-04-04T12:59:20Z,Trump says that chip tariffs are starting 'very soon'
AMD,2025-04-04T12:42:00Z,AMD Ryzen 7 9800X3D drives eight-core CPU adoption past six-core chips
AMD,2025-04-04T12:33:47Z,Apple Chip Supplier TSMC Close to Deal to Operate Intel’s Chipmaking Facilities
AMD,2025-04-04T12:19:30Z,"Best Buy - HP Victus 15.6"" Full HD Gaming Laptop, AMD Ryzen 5, 8GB DDR5 Memory, 512GB SSD $449.99"
AMD,2025-04-04T12:14:22Z,G.Skill unveils first 128GB DDR5-8000 memory kit and ultra-fast DDR5-9000 64GB options
AMD,2025-04-04T12:10:12Z,"Big time 60% price drop lands this AMD-powered Lenovo ThinkPad laptop with 64GB RAM and 120Hz OLED at $1,079 ($1,620 off)"
AMD,2025-04-04T12:01:00Z,"Intel revives iconic ""Intel Inside"" slogan with a modern twist"
AMD,2025-04-04T11:50:01Z,"AMD's alleged RX 9070 GRE will have less VRAM than 9070 XT and 9070, says new report"
AMD,2025-04-04T11:49:22Z,Show HN: The SQLite Drivers 25.04 Benchmarks Game (Golang)
AMD,2025-04-04T11:25:27Z,Nintendo Switch 2 vs ROG Ally: Which gaming handheld is better?
AMD,2025-04-04T11:15:00Z,"AMD moves 3x more CPUs than Intel, rakes in 5x the revenue on Amazon"
AMD,2025-04-04T11:14:34Z,Samsung’s originally $600 34-inch Odyssey G5 165Hz curved gaming monitor just hit the 2025 low at $290
AMD,2025-04-04T11:00:00Z,NVIDIA Engineer Fixes Early Linux 6.15 Performance Regression Affecting AMD GPU Drivers
AMD,2025-04-04T10:55:58Z,"Best Buy - HP 27"" Touch-Screen All-in-One with Adjustable Height, AMD Ryzen 7, 16GB Memory, 1TB SSD $899.99"
AMD,2025-04-04T10:55:38Z,Eight-core CPUs are becoming the new norm. Is it time to upgrade?
AMD,2025-04-04T10:30:00Z,Microsoft turns 50! Here are its 25 most important products and milestones
AMD,2025-04-04T10:00:26Z,Critical flaw in Apache Parquet’s Java Library allows remote code execution
AMD,2025-04-04T09:51:11Z,Think DeepSeek has cut AI spending? Think again
AMD,2025-04-04T09:30:01Z,GTA 5 Enhanced Edition Coming to PC Game Pass in April
AMD,2025-04-04T08:32:24Z,CERT-UA reports attacks in March 2025 targeting Ukrainian agencies with WRECKSTEEL Malware
AMD,2025-04-04T07:29:49Z,(PR) Shuttle Expanding AI-Accelerated XPC Nano Series With Intel-Based Model
AMZN,2025-04-05T14:15:23Z,Should You Forget Amazon? Why These Unstoppable Stocks Are Better Buys
AMZN,2025-04-05T13:00:00Z,"Nvidia's bad day, Microsoft's AI plans, Amazon's TikTok play, and Intel's future: Tech news roundup"
AMZN,2025-04-05T11:00:19Z,27 Genius Bedroom Products That'll Make You Want To Re-Do Your Whole Bedroom
AMZN,2025-04-05T07:54:55Z,"Mayport LLC Sells 70 Shares of Amazon.com, Inc. (NASDAQ:AMZN)"
AMZN,2025-04-05T07:54:54Z,"Amazon.com, Inc. (NASDAQ:AMZN) Shares Sold by Signify Wealth"
AMZN,2025-04-05T07:54:53Z,"Dravo Bay LLC Buys New Shares in Amazon.com, Inc. (NASDAQ:AMZN)"
AMZN,2025-04-05T07:54:53Z,"Crew Capital Management Ltd. Has $442,000 Stake in Amazon.com, Inc. (NASDAQ:AMZN)"
AMZN,2025-04-05T07:11:13Z,"Pinion Investment Advisors LLC Raises Holdings in Amazon.com, Inc. (NASDAQ:AMZN)"
AMZN,2025-04-05T07:11:12Z,"Amazon.com, Inc. (NASDAQ:AMZN) Shares Purchased by Westover Capital Advisors LLC"
AMZN,2025-04-05T07:11:12Z,"Amazon.com, Inc. (NASDAQ:AMZN) Shares Sold by Scott & Selber Inc."
AMZN,2025-04-05T07:11:10Z,"Patten Group Inc. Purchases 1,207 Shares of Amazon.com, Inc. (NASDAQ:AMZN)"
AMZN,2025-04-05T06:05:01Z,"Rep. David Taylor Buys Amazon.com, Inc. (NASDAQ:AMZN) Stock"
AMZN,2025-04-05T06:02:58Z,Best Retail Stocks To Follow Now – April 3rd
AMZN,2025-04-04T23:12:53Z,"Is Amazon.com, Inc. (AMZN) the Top Stock to Buy According to Think Investments?"
AMZN,2025-04-04T22:08:19Z,"Jim Cramer on Amazon (AMZN): “What Can I Say Other Than… Buy, Buy, Buy!”"
AMZN,2025-04-04T21:16:00Z,3 ASX ETFs I would buy and hold for a decade
AMZN,2025-04-04T18:26:26Z,Microsoft's Copilot gets personal for 50th anniversary
AMZN,2025-04-04T17:53:31Z,"Retail Investors Pour $4,700,000,000 Into Stock Market in One Day Amid Market Meltdown: JPMorgan Chase"
AMZN,2025-04-04T16:35:00Z,Warren Buffet's market wisdom when stocks fall is all in this 19th century poem
AMZN,2025-04-04T15:07:50Z,Market Analysis: Amazon.com And Competitors In Broadline Retail Industry
AMZN,2025-04-04T14:20:34Z,Apple And Meta Get Nixed — But Top Funds Binge On This Stock
AMZN,2025-04-04T14:15:00Z,"The Magnificent 7 stocks slide again and the Dow drops 1,100 points as China retaliates in trade war"
AMZN,2025-04-04T13:54:45Z,Wall Street now hates these 10 stocks because of Trump tariffs
AMZN,2025-04-04T13:30:27Z,Why Apple may surprise investors with AI after all
AMZN,2025-04-04T12:42:55Z,Wall Street hunts for cheap tariff-proof stocks after the carnage
AMZN,2025-04-04T12:10:00Z,"Mag 7, Exxon Nike, Lululemon: Stocks to watch today"
AMZN,2025-04-04T11:50:29Z,Strong Results Lifted Amazon.com (AMZN) in Q4
AMZN,2025-04-04T10:00:56Z,"Yahoo Finance newsroom analysis: How Trump's tariffs are affecting Big Tech, retailers, automakers, oil, and bonds"
AMZN,2025-04-04T07:44:58Z,"Keystone Wealth Services LLC Purchases 991 Shares of Amazon.com, Inc. (NASDAQ:AMZN)"
AMZN,2025-04-04T07:44:57Z,"Unified Investment Management Invests $1.87 Million in Amazon.com, Inc. (NASDAQ:AMZN)"
AMZN,2025-04-04T07:44:57Z,"Amazon.com, Inc. (NASDAQ:AMZN) is Charles Schwab Investment Management Inc.’s 4th Largest Position"
AMZN,2025-04-04T07:44:57Z,"Amazon.com, Inc. (NASDAQ:AMZN) Stake Trimmed by Marathon Asset Management Ltd"
AMZN,2025-04-04T07:44:56Z,"Tacita Capital Inc Raises Stock Holdings in Amazon.com, Inc. (NASDAQ:AMZN)"
AMZN,2025-04-04T07:44:56Z,"Amazon.com, Inc. (NASDAQ:AMZN) Holdings Boosted by State of Michigan Retirement System"
AMZN,2025-04-04T07:44:55Z,"Kelly Financial Group LLC Purchases New Position in Amazon.com, Inc. (NASDAQ:AMZN)"
AMZN,2025-04-04T07:44:54Z,"Amazon.com, Inc. (NASDAQ:AMZN) Shares Sold by Alta Capital Management LLC"
AMZN,2025-04-04T07:44:54Z,"Amazon.com, Inc. (NASDAQ:AMZN) Shares Bought by WMG Financial Advisors LLC"
AMZN,2025-04-03T23:02:31Z,"If You Invested $1000 In This Stock 10 Years Ago, You Would Have This Much Today"
AMZN,2025-04-03T20:47:47Z,"Analyst Explains Why He Loves Amazon.com (AMZN), Says Company Taking ‘Lion’s Share’ of Retail Growth"
AMZN,2025-04-03T20:45:07Z,ETF Investing: Should I buy VTS or A200?
AMZN,2025-04-03T20:24:17Z,Intel and TSMC reach tentative deal on chip manufacturing: Report
AMZN,2025-04-03T20:18:25Z,Should I buy the NDQ ETF after the Wall Street's crash?
AMZN,2025-04-03T18:53:00Z,Three ways Big Tech is vulnerable to EU tariff retaliation
AMZN,2025-04-03T17:57:27Z,"Apple sheds $300 billion in tariff-fueled sell-off, on track for worst drop since March 2020"
AMZN,2025-04-03T17:18:16Z,Citi Reportedly Tells Investors to Buy AMZN Stock on Weakness
AMZN,2025-04-03T16:56:10Z,Analyst Says Amazon.com (AMZN) Should ‘Continue to Compound’ – Here’s Why
AMZN,2025-04-03T16:53:47Z,Citi Reportedly Tells Investors to Buy AMZN Stock on Weakness
AMZN,2025-04-03T16:38:02Z,Analyst Says Amazon.com (AMZN) Should ‘Continue to Compound’ – Here’s Why
AMZN,2025-04-03T15:15:59Z,Exploring The Competitive Space: Amazon.com Versus Industry Peers In Broadline Retail
AMZN,2025-04-03T15:03:00Z,Veteran fund manager who forecast S&P 500 crash unveils surprising update
AMZN,2025-04-03T14:35:00Z,Apple leads Magnificent 7 stock drop amid Trump tariffs
AMZN,2025-04-03T13:30:46Z,"Stock market today: S&P 500, Nasdaq plunge, Dow drops 1,400 points as Trump's tariffs shock markets"
AMZN,2025-04-03T12:30:00Z,"Stocks tumble after Trump's tariff reveal, with Dow set to shed 1,000 points"
AMZN,2025-04-03T12:12:42Z,Big Tech 'Magnificent Seven' Stocks Take a Hammering in Premarket
AMZN,2025-04-03T12:07:26Z,Dividend Stocks: Smoking-Hot 7.3% Yield Lights Up Demand
AMZN,2025-04-03T12:03:33Z,"Questrade introduces $0 commission, real-time fractional stock and ETF trading, reminding Canadians there’s no better time to Get Yours"
AMZN,2025-04-03T12:00:00Z,"Questrade introduces $0 commission, real-time fractional stock and ETF trading, reminding Canadians there’s no better time to Get Yours"
AMZN,2025-04-03T11:58:00Z,"Mag 7, Nike, Lululemon, Deckers, PDD, GM: Stocks to watch"
AMZN,2025-04-03T10:18:33Z,Global Stocks Plunge on Larger-Than-Expected US Tariffs
AMZN,2025-04-03T09:30:01Z,AMZN Stock To $120? How Tariffs Could Reshape Amazon's Future
AMZN,2025-04-03T07:52:57Z,"Clal Insurance Enterprises Holdings Ltd Sells 212,842 Shares of Amazon.com, Inc. (NASDAQ:AMZN)"
AMZN,2025-04-03T07:52:57Z,"Amazon.com, Inc. (NASDAQ:AMZN) Holdings Lifted by Lanham O Dell & Company Inc."
AMZN,2025-04-03T07:52:56Z,"Modera Wealth Management LLC Grows Position in Amazon.com, Inc. (NASDAQ:AMZN)"
AMZN,2025-04-03T07:52:55Z,"Planning Directions Inc. Buys 1,898 Shares of Amazon.com, Inc. (NASDAQ:AMZN)"
AMZN,2025-04-03T07:02:57Z,"Smartleaf Asset Management LLC Acquires 18,827 Shares of Amazon.com, Inc. (NASDAQ:AMZN)"
AMZN,2025-04-03T07:02:57Z,"SRS Capital Advisors Inc. Has $15.21 Million Stock Holdings in Amazon.com, Inc. (NASDAQ:AMZN)"
AMZN,2025-04-03T07:02:56Z,"LGT Group Foundation Buys 44,045 Shares of Amazon.com, Inc. (NASDAQ:AMZN)"
AMZN,2025-04-03T07:02:56Z,"MMA Asset Management LLC Decreases Stock Position in Amazon.com, Inc. (NASDAQ:AMZN)"
AMZN,2025-04-03T07:02:55Z,"Pacific Global Investment Management Co. Has $2.62 Million Stock Holdings in Amazon.com, Inc. (NASDAQ:AMZN)"
AMZN,2025-04-03T07:02:48Z,"Amazon.com, Inc. (NASDAQ:AMZN) Shares Sold by Investment Partners LTD."
AMZN,2025-04-03T05:54:44Z,Westpark Capital Initiates Coverage on Amazon.com (NASDAQ:AMZN)
AMZN,2025-04-03T05:26:55Z,Direxion Daily AMZN Bull 2X Shares (NASDAQ:AMZU) Short Interest Up 25.6% in March
AMZN,2025-04-03T04:16:50Z,How are the 'Magnificent Seven' reacting to Trump's tarrifs in aftermarket trade?
AMZN,2025-04-02T23:16:01Z,Stock futures plunge as investors digest Trump’s tariffs | CNN Business
AMZN,2025-04-02T22:49:00Z,"Cramer Called Tech’s Bounce Back a Stay of Execution, But Amazon (AMZN), Apple (AAPL) and Broadcom (AVGO) Are Up Big Again"
AMZN,2025-04-02T22:05:00Z,"Mag 7, other stocks fall post-market after Trump's tariff announcement"
AMZN,2025-04-02T21:38:33Z,Stocks Tumble After Hours as Trump Announces Sweeping Reciprocal Tariffs
AMZN,2025-04-02T21:36:24Z,Tariffs slam retailers as Walmart and Nike face big losses
AMZN,2025-04-02T21:33:39Z,"Walmart, Target, Nike stocks drop as sweeping reciprocal tariffs are expected to hike consumer prices"
AMZN,2025-04-02T21:10:00Z,"I can own Apple, Nvidia, Microsoft, and Tesla with this simple ASX ETF"
AMZN,2025-04-02T19:18:48Z,Ray jobs on Amazon SageMaker HyperPod: scalable and resilient distributed AI
AMZN,2025-04-02T19:10:00Z,Hbar Foundation Teams Up With OnlyFans Founder for TikTok Bid: Reuters
AMZN,2025-04-02T19:07:05Z,Amazon targets April 9 launch of first Kuiper internet satellites
AMZN,2025-04-02T18:08:38Z,Experts Clash on Amazon’s (AMZN) Outlook
AMZN,2025-04-02T17:11:00Z,Amazon wants to buy TikTok as Trump's deadline looms
AMZN,2025-04-02T16:55:04Z,"Stock Is “Starting to Look Appealing,” Consumer Expert Says"
AMZN,2025-04-02T16:43:33Z,Amazon reportedly bids to buy TikTok as deadline looms
AMZN,2025-04-02T16:29:05Z,"Amazon (AMZN) Stock Is “Starting to Look Appealing,” Consumer Expert Says"
AMZN,2025-04-02T15:15:54Z,Evaluating Amazon.com Against Peers In Broadline Retail Industry
AMZN,2025-04-02T12:33:00Z,A coal plant in Pennsylvania was imploded to build an AI data center
AMZN,2025-04-02T11:56:00Z,"Tesla, Newsmax, Big Tech: Stocks to watch today"
