ticker,date,news
AMZN,2025-04-02T11:33:54Z,"Why Amazon, Walmart, and Target Stocks Dropped More Than 10% in March"
AMZN,2025-04-02T08:42:58Z,"Nixon Peabody Trust Co. Purchases 449 Shares of Amazon.com, Inc. (NASDAQ:AMZN)"
AMZN,2025-04-02T08:42:58Z,"Wilmar Advisors LLC Takes Position in Amazon.com, Inc. (NASDAQ:AMZN)"
AMZN,2025-04-02T08:42:57Z,"Heritage Wealth Management Inc. Buys 110 Shares of Amazon.com, Inc. (NASDAQ:AMZN)"
AMZN,2025-04-02T08:42:56Z,"Amazon.com, Inc. (NASDAQ:AMZN) is John G Ullman & Associates Inc.’s 8th Largest Position"
AMZN,2025-04-02T08:03:12Z,"Purkiss Capital Advisors LLC Purchases New Position in Amazon.com, Inc. (NASDAQ:AMZN)"
AMZN,2025-04-02T08:03:09Z,"Duncker Streett & Co. Inc. Grows Stock Position in Amazon.com, Inc. (NASDAQ:AMZN)"
AMZN,2025-04-02T08:03:08Z,"11,639 Shares in Amazon.com, Inc. (NASDAQ:AMZN) Bought by PCG Asset Management LLC"
AMZN,2025-04-02T08:03:07Z,"Amazon.com, Inc. (NASDAQ:AMZN) Shares Bought by Chase Investment Counsel Corp"
IBM,2025-04-05T13:11:19Z,"$65 billion pact gone! Elon Musk's DOGE drive didn't just affect federal workers; Deloitte, Accenture, among hardest hit"
IBM,2025-04-05T08:45:00Z,Open Source Software
IBM,2025-04-05T07:38:24Z,IBM: Is The Stock Price Overvalued?
IBM,2025-04-05T00:30:00Z,11 months & counting: Open Cloud Compute yet to go live
IBM,2025-04-04T23:14:52Z,International Business Machines (IBM) Integrates Intel Gaudi 3 on Cloud to Scale Enterprise AI Globally
IBM,2025-04-04T23:00:22Z,Y2K: What The Year 2000 Problem Was & Why People Feared The World Would End
IBM,2025-04-04T19:55:29Z,Microsoft’s 50th anniversary celebrations tainted by the company’s role in the genocide in Gaza
IBM,2025-04-04T19:46:14Z,Apple Intelligence servers might soon rely on a new Japanese chipmaker
IBM,2025-04-04T19:23:28Z,(PR) Tokyo Electron & IBM Renew Collaboration for Advanced Semiconductor Technology
IBM,2025-04-04T19:12:04Z,AI-Powered Golf Experiences - IBM Debuts New AI Features for the 2025 Masters Tournament (TrendHunter.com)
IBM,2025-04-04T18:31:52Z,The Microsoft of Today is Not the Microsoft of the Past
IBM,2025-04-04T18:21:32Z,An AlphaStation’s SROM
IBM,2025-04-04T18:17:33Z,Appeals court revives lawsuit alleging IBM bilked pensioners
IBM,2025-04-04T18:03:05Z,Appeals court revives lawsuit alleging IBM bilked pensioners
IBM,2025-04-04T17:19:07Z,Woke Employees' Worst Nightmare: Google Plays Pivotal Role in CBP's AI-Powered Border Surveillance Upgrade
IBM,2025-04-04T17:11:29Z,Intel Vision 2025: CEO Lip-Bu Tan Charts A New Course For Execution
IBM,2025-04-04T16:17:33Z,All of the news from Microsoft’s 50th Anniversary Copilot event
IBM,2025-04-04T16:14:59Z,Four Forces Shape The Future Of Technology Services
IBM,2025-04-04T16:00:00Z,Achieving Zero Trust and Air-Gapped IaC in IBM Cloud With Schematics
IBM,2025-04-04T16:00:00Z,"Quantum computers will be a dream come true for hackers, risking everything from military secrets to bank information. Can we stop them?"
IBM,2025-04-04T15:57:46Z,"Trump tanks tech, AI resets cybersecurity, and OpenAI sets a fundraising record"
IBM,2025-04-04T15:57:46Z,"Trump tanks tech, Intel and TSMC do a deal, and OpenAI sets a fundraising record"
IBM,2025-04-04T15:30:00Z,How Doris Connects to Multiple Databases for Federated Analytics and Data Migration
IBM,2025-04-04T14:49:20Z,kcli 99.0.202504041449
IBM,2025-04-04T14:38:52Z,Intel Vision 2025 Event: An Iconic American Semiconductor Tech Titan
IBM,2025-04-04T14:00:00Z,Preparing medical students to incorporate scientific evidence into patient care: A cross-sectional study
IBM,2025-04-04T14:00:00Z,"Population, demographic and socioeconomic characteristics associated with state preemption laws in the United States, 2009–2018"
IBM,2025-04-04T14:00:00Z,"Virtual Prototype Market Size to Surpass USD 1975.27 Million by 2032, Owing to the Growing Demand for Cost-Effective Product Development | SNS Insider"
IBM,2025-04-04T14:00:00Z,"GPU As A Service Market Size to Surpass USD 33.91 Billion by 2032, Owing to Growing Demand for AI and High-Performance Computing | SNS Insider"
IBM,2025-04-04T14:00:00Z,Development of an experimental model using cold stress to assess the pathogenicity of two Moroccan AI H9N2 isolates from 2016 and 2022 in commercial broiler chickens
IBM,2025-04-04T14:00:00Z,Validity and reliability of the Dietary Sodium Restriction Questionnaire in peritoneal dialysis patients
IBM,2025-04-04T13:55:00Z,Cloud Point of Sale (PoS) Market Report 2025-2029 & 2034 | From $8.37 Billion to $20.67 Billion: The Exponential Rise of the Cloud PoS Market
IBM,2025-04-04T13:30:00Z,"Out of sight, out of mind - thirsty, power-hungry Gen AI's hefty impact on the climate. Are we just going to ignore it?"
IBM,2025-04-04T13:23:04Z,Microsoft is now 50 years old
IBM,2025-04-04T13:18:17Z,A Visual History: Microsoft Windows Over the Decades
IBM,2025-04-04T13:18:17Z,A Visual History: Microsoft Windows Over the Decades
IBM,2025-04-04T13:16:46Z,"CMA clears IBM-HashiCorp deal, citing limited competition overlap"
IBM,2025-04-04T13:00:00Z,"Microsoft just turned 50, can its dominance last another"
IBM,2025-04-04T12:30:54Z,IBM: A Pioneer of Tech Giants
IBM,2025-04-04T12:00:09Z,Microsoft Turns 50: Where Are Its 12 Founding Employees Today?
IBM,2025-04-04T11:48:16Z,Google's AI will help Trump monitor the US-Mexico border
IBM,2025-04-04T10:30:00Z,"Every Microsoft Windows operating system, ranked"
IBM,2025-04-04T10:30:00Z,Microsoft turns 50! Here are its 25 most important products and milestones
IBM,2025-04-04T09:51:11Z,Think DeepSeek has cut AI spending? Think again
IBM,2025-04-04T09:50:12Z,Medicare Advantage Is Covering More and More Americans − Some Because They Don’t Get to Choose
IBM,2025-04-04T09:00:00Z,Microsoft turns 50: A look back at everything from the Altair to the Zune
IBM,2025-04-04T08:32:15Z,Crippling America’s Innovation Economy
IBM,2025-04-04T07:29:07Z,How do you explain what magnetic fields do to monitors to people wearing bowling shoes?
IBM,2025-04-04T06:37:00Z,Microsoft turns 50: Will AI make it even more powerful?
IBM,2025-04-04T05:27:03Z,The Great Skill Shift: How AI Is Transforming 70% Of Jobs By 2030
IBM,2025-04-04T05:15:00Z,Microsoft at 50: Enterprise IT for the masses
IBM,2025-04-04T05:00:00Z,Microsoft’s wildest moment in 50 years still makes us laugh
IBM,2025-04-04T05:00:00Z,Microsoft president Brad Smith: ‘Our support for Ireland is steadfast’
IBM,2025-04-04T04:00:00Z,New method assesses and improves the reliability of radiologists’ diagnostic reports
IBM,2025-04-04T03:40:41Z,The Rise of Quantum-Resistant Cryptography – Preparing for a Post-Quantum World
IBM,2025-04-04T00:03:58Z,"Americans See Lots of Reasons to Worry About AI, Pew Survey Finds"
IBM,2025-04-03T23:35:03Z,The bizarro world of Trumpian economics
IBM,2025-04-03T22:59:14Z,Show HN: A new VSCode extension that shows definition functions in a stack
IBM,2025-04-03T22:42:00Z,US Stock Markets See Worst Day Since Covid Pandemic
IBM,2025-04-03T21:18:23Z,What will quantum computing actually look like?
IBM,2025-04-03T20:51:00Z,Microsoft CTO predicts AI will generate 95 percent of code by 2030
IBM,2025-04-03T20:43:31Z,Ubuntu developers: Elizabeth K. Joseph: A VisionFive 2 and a Raspberry Pi 1 B
IBM,2025-04-03T19:32:41Z,Voice AI’s sweet spot: ordering fries with that
IBM,2025-04-03T19:06:45Z,The Shortest Path from Thoughts to Words (Premium)
IBM,2025-04-03T18:39:04Z,Installing AIX PS/2 v1.3 on a 486
IBM,2025-04-03T18:14:00Z,"How Bill Gates, the Altair 8800 and BASIC propelled me into the PC revolution"
IBM,2025-04-03T17:56:39Z,Can CEO Lip-Bu Tan Save Intel?
IBM,2025-04-03T17:40:07Z,The Mag 7 Gets Whacked. Here Are 5 Other Tech Stocks to Play
IBM,2025-04-03T16:20:14Z,"Cyberattacks Could Shutter One In Five Small Businesses, Report Finds"
IBM,2025-04-03T15:30:00Z,Europe Wearable AI Market Report 2024-2025 & 2031: Robust Growth Projected with Healthcare and Industrial Applications Leading the Charge
IBM,2025-04-03T15:27:29Z,How Cisco’s CIO Uses AI And Tech To Expand Company Culture
IBM,2025-04-03T15:20:00Z,Combatting Bias in AI Systems
IBM,2025-04-03T14:39:00Z,"Zero Trust Network Access Strategic Business Report 2024-2030, Competitive Analysis of Akamai, Broadcom, Check Point Software, Cisco Systems, CloudFlare, Crowdstrike, Forcepoint, Fortinet, IBM, Okta"
IBM,2025-04-03T14:23:00Z,"Financial Automation Business Analysis Report 2025: AI-Powered Tools Propel Growth in Decision-Making, Regulatory Compliance Requirements Drive Adoption - Global Market Forecast to 2030"
IBM,2025-04-03T14:00:00Z,"Effect of opioid-free anesthesia combined with pectoral nerve block on the quality of recovery in patients after mastectomy: A randomized, controlled trial"
IBM,2025-04-03T14:00:00Z,Time-restricted feeding reduced blood pressure and improved cardiac structure and function by regulating both circulating and local renin-angiotensin systems in spontaneously hypertensive rat model
IBM,2025-04-03T14:00:00Z,Passive compliance or active innovation: The diffusion of public sport policies in China
IBM,2025-04-03T13:57:44Z,IBM Boosts Canadian AI Infrastructure With Montreal And Toronto Cloud Advances
IBM,2025-04-03T13:46:29Z,Security updates for Thursday
IBM,2025-04-03T13:43:48Z,Remember These 10 Breakthrough Microsoft Products?
IBM,2025-04-03T13:43:48Z,Remember These 10 Breakthrough Microsoft Products?
IBM,2025-04-03T13:00:52Z,A web3 startup aims to change the game in the tariff wars | TechCrunch
IBM,2025-04-03T12:21:31Z,Medicare Advantage is covering more and more Americans − some because they don’t get to choose
IBM,2025-04-03T12:00:00Z,‘I don’t want fights’: He’s found love with an AI girlfriend. But is she curing the loneliness epidemic or just ‘weird and unhealthy’?
IBM,2025-04-03T12:00:00Z,A New Force of Indian Country
IBM,2025-04-03T11:52:00Z,"Citizen Services AI Market to Grow Exponentially, Reaching $43.52 Billion by 2029 | Maximizing Market Growth with Automation and AI Integration"
IBM,2025-04-03T11:12:03Z,Intel refreshes iconic brand with 'That's the power of Intel Inside' campaign
IBM,2025-04-03T10:00:00Z,The Unforeseen Consequences Of Revoking EO 14110: A Call For Content Authenticity
IBM,2025-04-03T10:00:00Z,Google Is Helping the Trump Administration Deploy AI Along the Mexican Border
IBM,2025-04-03T10:00:00Z,"The Hemline Index, and other fashionable follies"
IBM,2025-04-03T09:00:14Z,"Microsoft at 50: Its incredible rise, 15 lost years, and stunning comeback - in 4 charts"
IBM,2025-04-03T08:46:29Z,"Do it like Elon Musk: Leaked email reveals Tesla CEO’s simple work rules for business success, ‘Walk out of a meeting…’"
IBM,2025-04-03T07:00:00Z,Simplify AI data integration with RamaLama and RAG
IBM,2025-04-03T03:41:24Z,JVNDB-2024-021320:IBM の IBM App Connect Enterprise Certified Containers Operands および IBM App Connect Operator における入力の構文的正当性の検証に関する脆弱性
IBM,2025-04-03T02:40:08Z,Why I Maintain a 17 Year Old ThinkPad
IBM,2025-04-03T02:22:28Z,Monash College ran 60 scenarios in a week on foreign student caps
IBM,2025-04-03T01:00:00Z,RedHat Linux Kernel Multiple Vulnerabilities
IBM,2025-04-03T00:49:12Z,Ghost in the Machine: AI’s Verdict on AI Investing
IBM,2025-04-03T00:23:30Z,Linux 6.15 Removes Support For IBM's CXL/CAPI Drivers
ORCL,2025-04-05T06:02:55Z,Best Blockchain Stocks To Watch Now – April 3rd
ORCL,2025-04-05T03:14:26Z,"Jim Cramer on Oracle (ORCL): “Warning Sign—Lost a Key Contract, That’s Not Good!”"
ORCL,2025-04-04T22:18:33Z,Oracle Corporation (ORCL): Among the Best Innovative Stocks to Buy According to Analysts
ORCL,2025-04-04T15:30:00Z,How Doris Connects to Multiple Databases for Federated Analytics and Data Migration
ORCL,2025-04-04T06:38:48Z,Healthcare Stocks To Consider – April 2nd
ORCL,2025-04-04T06:06:53Z,Best Manufacturing Stocks To Keep An Eye On – April 2nd
ORCL,2025-04-03T16:53:47Z,Citi Reportedly Tells Investors to Buy AMZN Stock on Weakness
ORCL,2025-04-03T12:29:38Z,a Fast Growing Business?
ORCL,2025-04-03T12:18:38Z,Is Oracle (ORCL) a Fast Growing Business?
ORCL,2025-04-03T06:04:52Z,Top Manufacturing Stocks To Research – April 1st
ORCL,2025-04-03T00:06:57Z,"Stock market today: Nasdaq futures lead stock plunge, Dow drops 1,000 points as Trump's punishing tariffs rip through markets"
ORCL,2025-04-02T22:07:36Z,*20% ON EU...
ORCL,2025-04-02T19:44:11Z,Is Oracle Corp. (ORCL) the Best Data Storage Stock to Invest in According to Analysts?
ORCL,2025-04-02T17:11:00Z,Amazon wants to buy TikTok as Trump's deadline looms
ORCL,2025-04-02T06:58:52Z,Oracle (NYSE:ORCL) Earns Buy Rating from Analysts at Westpark Capital
ORCL,2025-04-02T06:18:46Z,Oracle (NYSE:ORCL) Price Target Cut to $190.00 by Analysts at Jefferies Financial Group
ORCL,2025-04-01T16:59:26Z,Nvidia-Backed AI Stock CoreWeave Rebounds To Overtake Downsized IPO Price
ORCL,2025-04-01T12:20:00Z,"OpenAI is now worth more than Chevron, McDonald's, and Salesforce"
ORCL,2025-04-01T08:02:51Z,Promising Blockchain Stocks To Follow Today – March 29th
ORCL,2025-04-01T06:34:43Z,Top Healthcare Stocks Worth Watching – March 30th
ORCL,2025-04-01T06:02:47Z,Promising Manufacturing Stocks To Watch Today – March 30th
ORCL,2025-03-31T19:00:19Z,Nvidia To Invest Billions In U.S. Supply Chain As Tech Companies Commit To Trump's Onshoring Pledge
ORCL,2025-03-31T14:16:45Z,TikTok's days are numbered as ban nears
ORCL,2025-03-31T09:28:58Z,Promising Healthcare Stocks To Watch Today – March 28th
ORCL,2025-03-31T08:03:06Z,Manufacturing Stocks Worth Watching – March 28th
ORCL,2025-03-31T06:02:54Z,Healthcare Stocks To Research – March 29th
ORCL,2025-03-31T06:02:48Z,Top Manufacturing Stocks To Follow Now – March 29th
ORCL,2025-03-31T03:16:02Z,Jim Cramer Pulling Back on Oracle Corporation (ORCL) – Waiting for CoreWeave Clarity!
ORCL,2025-03-30T15:06:54Z,Is Oracle Stock a Buy Now?
ORCL,2025-03-30T06:40:43Z,"Rep. Robert Bresnahan, Jr. Sells Oracle Co. (NYSE:ORCL) Stock"
ORCL,2025-03-30T06:02:57Z,Blockchain Stocks To Keep An Eye On – March 28th
ORCL,2025-03-29T14:16:16Z,Oracle Corp (ORCL): Among Billionaire Ken Fisher’s Top Growth Stock Picks
ORCL,2025-03-29T06:32:43Z,Top Healthcare Stocks Worth Watching – March 27th
ORCL,2025-03-29T06:01:02Z,Manufacturing Stocks To Keep An Eye On – March 27th
ORCL,2025-03-28T22:41:09Z,Is Oracle Corporation (ORCL) The Mega Cap Stock Gaining Bullish Momentum This Week?
ORCL,2025-03-27T14:24:54Z,$1000 Invested In This Stock 10 Years Ago Would Be Worth This Much Today
ORCL,2025-03-26T13:40:25Z,CoreWeave’s IPO Valuation Is Rotten To The Core
ORCL,2025-03-25T17:20:00Z,The Trump administration is being asked to relax some AI chip rules
ORCL,2025-03-25T14:55:00Z,Alibaba's chairman thinks there's an AI data center bubble
ORCL,2025-03-25T06:09:00Z,Best Blockchain Stocks To Keep An Eye On – March 23rd
ORCL,2025-03-24T16:24:07Z,Is Oracle Corporation (ORCL) the Best Predictive Analytics Stock to Buy According to Analysts?
ORCL,2025-03-24T06:06:43Z,Manufacturing Stocks To Research – March 22nd
ORCL,2025-03-23T19:59:56Z,Prediction: Oracle Stock Could Surge by 200% in the Next 5 Years
ORCL,2025-03-23T06:03:08Z,Blockchain Stocks To Add to Your Watchlist – March 21st
ORCL,2025-03-22T15:48:25Z,"U.S. ByteDance investors looking into TikTok U.S. deal, FT reports"
ORCL,2025-03-22T15:35:59Z,"U.S. ByteDance investors looking into TikTok U.S. deal, FT reports"
ORCL,2025-03-22T07:06:58Z,Stephens Begins Coverage on Oracle (NYSE:ORCL)
ORCL,2025-03-20T14:56:00Z,Oracle's is now letting businesses create their own AI agents. No coding required
ORCL,2025-03-20T06:34:42Z,Manufacturing Stocks Worth Watching – March 18th
ORCL,2025-03-20T01:58:47Z,SoftBank Group to Acquire Ampere Computing for 6.5B
ORCL,2025-03-20T01:53:24Z,SoftBank Group to Acquire Ampere Computing
ORCL,2025-03-19T23:36:44Z,SoftBank Group to Acquire Ampere Computing
ORCL,2025-03-18T17:36:57Z,Google is testing Trump's new antitrust cops with $32 billion Wiz deal
ORCL,2025-03-18T15:22:00Z,Google's biggest buy ever
ORCL,2025-03-18T07:50:53Z,Oracle Co. (NYSE:ORCL) Position Boosted by Proficio Capital Partners LLC
ORCL,2025-03-18T06:07:03Z,Blockchain Stocks Worth Watching – March 16th
ORCL,2025-03-17T08:00:00Z,Six Dividend Growth Stocks Raising Dividends Last Week
ORCL,2025-03-17T06:40:46Z,Blockchain Stocks To Consider – March 15th
ORCL,2025-03-17T05:54:53Z,Analysts Set Oracle Co. (NYSE:ORCL) PT at $179.71
ORCL,2025-03-15T06:56:45Z,William Blair Has Bearish Forecast for Oracle Q2 Earnings
ORCL,2025-03-15T06:22:54Z,William Blair Issues Pessimistic Outlook for Oracle Earnings
ORCL,2025-03-15T06:02:54Z,Healthcare Stocks To Keep An Eye On – March 13th
ORCL,2025-03-15T06:02:52Z,Promising Manufacturing Stocks To Keep An Eye On – March 13th
ORCL,2025-03-15T05:39:05Z,Oracle (NYSE:ORCL) Shares Down 2.2% on Analyst Downgrade
ORCL,2025-03-14T09:28:52Z,What is DA Davidson’s Forecast for Oracle FY2025 Earnings?
ORCL,2025-03-14T07:00:51Z,Citigroup Has Lowered Expectations for Oracle (NYSE:ORCL) Stock Price
ORCL,2025-03-14T07:00:51Z,Equities Analysts Issue Forecasts for Oracle Q4 Earnings
ORCL,2025-03-13T08:44:59Z,BMO Capital Markets Has Lowered Expectations for Oracle (NYSE:ORCL) Stock Price
ORCL,2025-03-13T08:44:56Z,Cantor Fitzgerald Analysts Cut Earnings Estimates for Oracle
ORCL,2025-03-13T08:44:48Z,JPMorgan Chase & Co. Issues Pessimistic Forecast for Oracle (NYSE:ORCL) Stock Price
ORCL,2025-03-13T08:44:48Z,Cantor Fitzgerald Issues Pessimistic Forecast for Oracle (NYSE:ORCL) Stock Price
ORCL,2025-03-13T06:55:00Z,Oracle (ORCL) – Investment Analysts’ Weekly Ratings Changes
ORCL,2025-03-13T06:41:06Z,Morgan Stanley Cuts Oracle (NYSE:ORCL) Price Target to $170.00
ORCL,2025-03-13T06:41:04Z,Evercore ISI Issues Pessimistic Forecast for Oracle (NYSE:ORCL) Stock Price
ORCL,2025-03-13T06:40:51Z,Piper Sandler Has Lowered Expectations for Oracle (NYSE:ORCL) Stock Price
ORCL,2025-03-13T06:40:51Z,Barclays Issues Pessimistic Forecast for Oracle (NYSE:ORCL) Stock Price
ORCL,2025-03-12T16:36:25Z,Why software stocks could be a safe haven for investors in a tariff-induced recession
ORCL,2025-03-12T13:59:16Z,Oracle (NYSE:ORCL) Given New $200.00 Price Target at UBS Group
ORCL,2025-03-12T13:59:13Z,KeyCorp Reaffirms “Overweight” Rating for Oracle (NYSE:ORCL)
ORCL,2025-03-12T12:24:47Z,Can Oracle Stock Fall To $110?
ORCL,2025-03-12T12:22:12Z,5 Things to Know Before the Stock Market Opens
ORCL,2025-03-12T10:34:49Z,Oracle (NYSE:ORCL) Receives “Neutral” Rating from DA Davidson
ORCL,2025-03-12T08:14:58Z,Oracle (NYSE:ORCL) Shares Down 5.2% on Disappointing Earnings
ORCL,2025-03-12T07:40:57Z,Bank of America Has Lowered Expectations for Oracle (NYSE:ORCL) Stock Price
ORCL,2025-03-12T05:47:00Z,Oracle (NYSE:ORCL) Trading Down 4.1% After Earnings Miss
ORCL,2025-03-12T05:14:47Z,Oracle (NYSE:ORCL) Shares Gap Down After Earnings Miss
ORCL,2025-03-11T15:02:00Z,The Dow drops 550 points as Trump shrugs off a market rout and says more tariffs are coming
ORCL,2025-03-11T13:23:52Z,"Tesla, Nvidia, Oracle, Delta, Southwest: Stocks to watch today"
ORCL,2025-03-11T09:57:00Z,Oracle stock gives investors whiplash as Larry Ellison touts AI 'hypergrowth' but earnings fall short
ORCL,2025-03-11T09:56:54Z,"'테슬라 킬러' 전설이 마침내 실현되었고, 그 사람은 바로"
ORCL,2025-03-11T09:55:14Z,Is Oracle Stock a Buy?
ORCL,2025-03-10T22:11:09Z,Dan Niles Says Oracle (ORCL)’s AI Capex to Decline
ORCL,2025-03-10T14:31:21Z,5 Things to Know Before the Stock Market Opens
ORCL,2025-03-10T13:30:40Z,"Stock market today: Dow, S&P 500, Nasdaq sink after S&P's worst week since September"
ORCL,2025-03-10T13:30:40Z,"Stock market today: Nasdaq, S&P 500 lead losses as market sell-off accelerates"
ORCL,2025-03-10T12:41:00Z,"Nvidia, Tesla, Oracle, Palantir, Coinbase, Doordash: Stocks to watch today"
ORCL,2025-03-10T12:28:22Z,5 Things to Know Before the Stock Market Opens
ORCL,2025-03-09T10:00:00Z,What To Expect in the Markets This Week
ORCL,2025-03-09T09:00:00Z,"Adobe, Oracle, Kohl's, and more stocks to watch this week"
ORCL,2025-03-09T08:21:06Z,Best Blockchain Stocks To Keep An Eye On – March 6th
ACN,2025-04-04T08:55:05Z,Best Industrial Stocks To Watch Today – April 2nd
ACN,2025-04-04T06:06:51Z,Artificial Intelligence Stocks To Watch Now – April 2nd
ACN,2025-04-03T12:08:11Z,Jim Cramer on Accenture (ACN): Buy If You Think Musk Leaves DOGE
ACN,2025-04-03T11:39:11Z,Jim Cramer on Accenture (ACN): Buy If You Think Musk Leaves DOGE
ACN,2025-04-03T06:04:53Z,Industrial Stocks Worth Watching – April 1st
ACN,2025-04-02T06:02:49Z,Top Metaverse Stocks To Research – March 31st
ACN,2025-04-01T16:57:17Z,Accenture plc (ACN): Among the Best Consulting Stocks to Buy According to Hedge Funds
ACN,2025-04-01T14:00:00Z,DHX15 inhibits mouse APOBEC3 deamination
ACN,2025-03-31T23:57:45Z,Accenture (ACN) Teams Up with Siemens to Revolutionize Engineering and Manufacturing with AI
ACN,2025-03-31T14:00:00Z,Spatial proteomics of Onchocerca volvulus with pleomorphic neoplasms shows local and systemic dysregulation of protein expression
ACN,2025-03-31T14:00:00Z,Doxifluridine promotes host longevity through bacterial metabolism
ACN,2025-03-31T14:00:00Z,"Exposure to circadian disrupting environment and high-fat diet during pregnancy and lactation alter reproductive competence and lipid profiles of liver, mammary, plasma and milk of ICR mice"
ACN,2025-03-31T14:00:00Z,Incomplete lytic cycle of a widespread Bacteroides bacteriophage leads to the formation of defective viral particles
ACN,2025-03-31T13:45:40Z,Is Accenture plc (ACN) the Most Oversold Large Cap Stock to Invest in Now?
ACN,2025-03-31T12:18:00Z,Transactions in connection with share buy-back program
ACN,2025-03-31T08:48:49Z,Best Metaverse Stocks To Follow Now – March 28th
ACN,2025-03-31T08:03:02Z,Promising Artificial Intelligence Stocks To Consider – March 28th
ACN,2025-03-30T19:34:00Z,These are the 10 most shorted ASX shares
ACN,2025-03-28T13:08:38Z,Why Are Analysts Bullish on Accenture (ACN) for 2025?
ACN,2025-03-28T07:40:46Z,Analysts Set Accenture plc (NYSE:ACN) PT at $378.91
ACN,2025-03-27T15:19:00Z,Buy These 7%+ Recession-Resistant Dividends Now
ACN,2025-03-27T12:32:32Z,Animoca Brands partners with Soneium by Sony Block Solutions Labs to develop Moca Network’s identity layer and launch San FranTokyo’s anime initiatives on Soneium
ACN,2025-03-27T12:00:00Z,"TIVDAK® (tisotumab vedotin) Approved by Japan Ministry of Health, Labour and Welfare for the Treatment of Advanced or Recurrent Cervical Cancer that has Progressed on or after Chemotherapy"
ACN,2025-03-27T07:22:54Z,Accenture (NYSE:ACN) Given New $355.00 Price Target at BMO Capital Markets
ACN,2025-03-27T06:10:56Z,Metaverse Stocks To Watch Now – March 25th
ACN,2025-03-27T00:00:00Z,"2-Methyl tetrahydrofuran: a green organic modifier for eco-friendly, cost-effective, and rapid purification in drug discovery"
ACN,2025-03-26T12:00:00Z,Young Christian in Pakistan brutally attacked for refusing to convert to Islam
ACN,2025-03-26T05:42:55Z,Barclays Lowers Accenture (NYSE:ACN) Price Target to $390.00
ACN,2025-03-25T21:28:00Z,Genmab Announces Initiation of Share Buy-Back Program
ACN,2025-03-25T04:00:00Z,Discussions on possible frauds in Europe continue to decline
ACN,2025-03-24T07:38:57Z,Artificial Intelligence Stocks To Consider – March 22nd
ACN,2025-03-24T07:13:05Z,Top Industrial Stocks To Watch Now – March 22nd
ACN,2025-03-24T06:50:44Z,Royal Bank of Canada Issues Pessimistic Forecast for Accenture (NYSE:ACN) Stock Price
ACN,2025-03-24T06:12:56Z,Guggenheim Has Lowered Expectations for Accenture (NYSE:ACN) Stock Price
ACN,2025-03-24T00:00:00Z,The solvent engineering by ACN for the growth of high-quality CsPbBr3 single crystals
ACN,2025-03-23T22:30:59Z,These are the 10 most shorted ASX shares
ACN,2025-03-23T07:44:54Z,Accenture (NYSE:ACN) Price Target Cut to $387.00 by Analysts at UBS Group
ACN,2025-03-23T06:03:09Z,Best Metaverse Stocks To Follow Today – March 21st
ACN,2025-03-22T14:07:10Z,Accenture price target lowered to $365 from $394 at TD Cowen
ACN,2025-03-22T07:24:49Z,Accenture plc (NYSE:ACN) Stake Lifted by Proficio Capital Partners LLC
ACN,2025-03-22T06:40:52Z,Mizuho Cuts Accenture (NYSE:ACN) Price Target to $398.00
ACN,2025-03-22T06:40:50Z,Accenture (NYSE:ACN) Price Target Cut to $364.00 by Analysts at Piper Sandler
ACN,2025-03-22T06:38:47Z,Industrial Stocks To Watch Now – March 20th
ACN,2025-03-22T06:05:07Z,Artificial Intelligence Stocks To Follow Today – March 20th
ACN,2025-03-22T03:29:00Z,Genmab to Vigorously Defend Alleged Claims of Trade Secret Misappropriation by AbbVie Inc.
ACN,2025-03-21T18:00:43Z,Palantir Hovers Near 50 Day Line As AI Stocks Struggle
ACN,2025-03-21T15:51:32Z,Barclays remains buyer of Accenture on weakness
ACN,2025-03-21T13:56:57Z,These Analysts Lower Their Forecasts On Accenture Following Q2 Results
ACN,2025-03-21T13:01:03Z,Hegseth Cancels Defense Contracts. IT Government Contractors Sell Off.
ACN,2025-03-21T09:19:00Z,"Catholic aid ""the hand of God"" in suffering Mozambique"
ACN,2025-03-21T06:05:05Z,Metaverse Stocks To Watch Now – March 19th
ACN,2025-03-21T05:22:48Z,Accenture (NYSE:ACN) Shares Gap Down After Analyst Downgrade
ACN,2025-03-20T20:21:39Z,IBM Stock Falls Below Key Level On Accenture Warning About Slowing U.S. Government Tech Spending
ACN,2025-03-20T11:46:00Z,"Nvidia, Micron, Nike, Darden, Zeekr, FedEx, Accenture: Stocks to watch today"
ACN,2025-03-20T07:06:42Z,Accenture (NYSE:ACN) Upgraded at Baird R W
ACN,2025-03-20T06:28:53Z,BMO Capital Markets Lowers Accenture (NYSE:ACN) Price Target to $370.00
ACN,2025-03-19T07:14:54Z,Best Metaverse Stocks To Watch Now – March 17th
